{
  "$schema": "../../schemas/workflow-pack.schema.json",
  "workflowId": "website-header",
  "displayName": "Website Section Visual",
  "purpose": "Create a reusable section header or campaign visual with exact hierarchy and inspected responsive crops.",
  "surfaces": ["section header", "campaign banner", "product route visual", "newsletter visual", "open graph image"],
  "allowedProductionRoutes": ["real product capture", "verified preview capture", "HTML or Satori renderer", "Remotion still", "Figma", "art-directed source image"],
  "requiredOutputs": [
    { "kind": "source brief", "pathHint": "brief.md" },
    { "kind": "desktop crop", "pathHint": "crops/desktop.png", "dimensions": "1600x900" },
    { "kind": "mobile crop", "pathHint": "crops/mobile.png", "dimensions": "1080x1350" },
    { "kind": "open graph crop", "pathHint": "crops/og.png", "dimensions": "1200x630" },
    { "kind": "evidence", "pathHint": "evidence.json" }
  ],
  "qaGates": ["brand pack loaded", "desktop and mobile inspected", "first-read passes", "no clipping", "provenance recorded"],
  "scoreThreshold": 26,
  "scoreScale": 30,
  "blockedRoutes": ["generic abstract filler", "fake dashboard", "uninspected generated media", "cheap placeholder art"],
  "approvalRequired": true,
  "updatedAt": "2026-07-24"
}
