{
  "$schema": "../../schemas/workflow-pack.schema.json",
  "workflowId": "social-static",
  "displayName": "Social Static Image",
  "version": "2026-07-16",
  "purpose": "Create one exact, on-brand social image for a feed post, proof card, quote card, or announcement. Hybrid allowed: premium gen for creative bases; deterministic renderer for exact public text, claims, UI, and charts.",
  "surfaces": [
    "LinkedIn feed image",
    "Instagram feed image",
    "X image post",
    "Threads image post",
    "website social proof reuse"
  ],
  "allowedProductionRoutes": [
    "HTML/CSS renderer",
    "Satori/OG renderer",
    "Playwright capture of deterministic template",
    "Figma",
    "Canva",
    "browser capture",
    "image generation for background/source frame only",
    "premium creative-infographic route with character-level text QA (Grok / Infogenius / GPT-image family)"
  ],
  "requiredOutputs": [
    { "kind": "source brief", "pathHint": "brief.md" },
    { "kind": "media job", "pathHint": "media-job.json" },
    { "kind": "square crop", "pathHint": "crops/square.png", "dimensions": "1080x1080" },
    { "kind": "portrait crop", "pathHint": "crops/portrait.png", "dimensions": "1080x1350" },
    { "kind": "og crop", "pathHint": "crops/og.png", "dimensions": "1200x628" },
    { "kind": "story crop", "pathHint": "crops/story.png", "dimensions": "1080x1920" },
    { "kind": "evidence", "pathHint": "evidence.json" }
  ],
  "qaGates": [
    "active taste constitution and founder-approved brand territory loaded",
    "sentence case used except for established acronyms",
    "exact text rendered deterministically unless premium creative-infographic exception is explicit and fully inspected",
    "actual output path exists for all four crops",
    "square, portrait, og, and story crops inspected",
    "logo-off recognition and color-swap tests passed",
    "diagnostic score plus independent critique recorded",
    "human approval required before public posting"
  ],
  "scoreThreshold": 26,
  "scoreScale": 30,
  "blockedRoutes": [
    "raw image generation containing final public text without creative-infographic exception + character QA",
    "fake UI",
    "uncited claims",
    "generic gradient filler as primary asset",
    "all-caps decorative copy or status chrome",
    "shared dark AI-dashboard styling used as a brand shortcut",
    "maker self-score used as approval",
    "Hermes image_generate until backend and first output path are verified"
  ],
  "approvalRequired": true,
  "updatedAt": "2026-07-16"
}
